{"canary_result_id":"canary/exact-lob-min@1.1.0","created_at":"2026-08-21T00:00:00Z","engine":{"engine_id":"min-lob-a","engine_version":"2.0.0"},"fixture":{"fixture_digest":"4256b1988a0bea0b70333a9545910f61c45ac60f08041e040fabdb6d6bc02f84","fixture_id":"canary/exact-lob-min","fixture_version":"1.1.0"},"mode":"exact","payload":{"expected":{"output_digest":"9518f58250af92fe8584e564759fe49223fc6da946491d4a6dbc831c717e206f","stats_vector_digest":"461bbbc85b7200c602c4dd39d020d740a3e4da0087ff658019c08f82a79c8ead"},"observed":{"output_byte_digest":"f60f2970050f66ec676e519c1a1bc1d8d80cbca31bc5e172a9d14e79b6e0c0e2","output_canonical_form":"event_log","output_digest":"9518f58250af92fe8584e564759fe49223fc6da946491d4a6dbc831c717e206f","stats_vector_digest":"461bbbc85b7200c602c4dd39d020d740a3e4da0087ff658019c08f82a79c8ead"},"precondition":{"effective_config":{"expected_digest":"f5799350e3b50623dd3bc4f82851896e5be30ff13ffef50651f8795d786b0081","observed_digest":"f5799350e3b50623dd3bc4f82851896e5be30ff13ffef50651f8795d786b0081","status":"match"},"environment_fingerprint":{"expected_digest":"b48aa171c67ad1faff9aab42b30f73767048ded7989e6c66723cfd9f7f649c23","observed_digest":"b48aa171c67ad1faff9aab42b30f73767048ded7989e6c66723cfd9f7f649c23","reason":"the interpreter version is outside this fixture's registered domain by declaration (fixture.json precondition.layers); a real engine's exact fixture uses the full runtime fingerprint domain","status":"match"},"input":{"expected_digest":"ba8eef64acc216d56b72a0d0d2387e54e5d72e9a968cfb742be7c1b8fa45d641","observed_digest":"ba8eef64acc216d56b72a0d0d2387e54e5d72e9a968cfb742be7c1b8fa45d641","status":"match"}}},"schema_version":"1.0.0","stats_vector":{"digest":"461bbbc85b7200c602c4dd39d020d740a3e4da0087ff658019c08f82a79c8ead","spec_id":"lob-common-surface","spec_version":"1.0.0","values":[329,208,33,80,0,8,40,187,227,53,53,34,38,0,0,100,136,996,997,1,996.575,0.609615384615]},"verdict":"MATCH","verdict_reason":"both digests reproduce exactly"}
